{
  "id": "ev_79e48050-89c0-4e63-a8d7-d49a8c94eba3",
  "taskId": "tsk_f450da26-1d45-488e-a577-bbfdaee991b0",
  "correlationId": "cor_6fe0caaa-aa44-4cc9-8c40-b36335dbd4f7",
  "type": "OPENCODE_ATTEMPT",
  "command": "POST /session",
  "exitCode": 0,
  "startedAt": "2026-09-28T10:29:40.031Z",
  "finishedAt": "2026-09-28T10:29:40.031Z",
  "stdout": "",
  "stderr": "",
  "filesChanged": [],
  "gitStatus": "",
  "hash": "af1473b977a7357ede92b65aef33c86c3378badec25cdda38ebb69c6bb6f6a5e",
  "source": "opencode-adapter",
  "status": "SESSION_CREATED",
  "durationMs": 0,
  "workingDirectory": "D:\\isbulkktc",
  "agent": "build",
  "sessionId": "ses_f186fd64affe4eNA0Y1PhwR6Bd",
  "promptMessageId": "msg_866e4029-5152-4a71-8f50-1a5763828fba",
  "providerId": "opencode",
  "modelId": "space-bunny-free",
  "projectId": "97c743cd73393b6648837204171935e967f4ae90",
  "worktree": "D:\\isbulkktc",
  "attempt": 2
}
