{
  "id": "ev_74924dfe-89c5-4e6e-b6a3-32c744628d82",
  "taskId": "tsk_af6da4ac-7f1c-4b03-ad8b-dd175373894f",
  "correlationId": "cor_437cf506-d47a-4a41-bb0d-62f22dcba535",
  "type": "COMMAND",
  "command": "OpenCode dispatch start",
  "exitCode": 0,
  "startedAt": "2026-09-28T01:56:34.223Z",
  "finishedAt": "2026-09-28T01:56:34.223Z",
  "stdout": "Updated tsk_af6da4ac-7f1c-4b03-ad8b-dd175373894f: READY -> DISPATCHING",
  "stderr": "",
  "filesChanged": [],
  "gitStatus": " M .agents/orchestrator/state/state.json\n M .agents/orchestrator/tasks/tsk_e3af6954-cb95-4588-b42f-32f71e7c5181.json\n M \"bilesenler/ilan/IlanKart\\304\\261.tsx\"\n M docs/AJAN-KOORDINASYON.md\n?? .agents/orchestrator/evidence/ev_0fe86876-38eb-441a-adc6-2aafad880388.json\n?? .agents/orchestrator/evidence/ev_151609e9-4c9f-467d-b44a-31acb35bb6c6.json\n?? .agents/orchestrator/evidence/ev_15fd0f1d-8221-4e0c-8a97-509e2509174f.json\n?? .agents/orchestrator/evidence/ev_18f310a2-a8e7-458a-9e10-e154e8db4a47.json\n?? .agents/orchestrator/evidence/ev_259d778a-59d7-4ce9-88bc-6082de5d8880.json\n?? .agents/orchestrator/evidence/ev_2f66d597-2db2-41b3-b53d-59aed89e4c3a.json\n?? .agents/orchestrator/evidence/ev_4849979d-6a91-4a5c-b0ae-9d11740b1aea.json\n?? .agents/orchestrator/evidence/ev_48bc9f8b-6881-42e8-a3fa-5f6fe743eafc.json\n?? .agents/orchestrator/evidence/ev_4a24f641-84f2-4679-aa49-17663f5e9d67.json\n?? .agents/orchestrator/evidence/ev_5dcba7fe-f959-4be7-bec5-be768b8ceec1.json\n?? .agents/orchestrator/evidence/ev_6cfe806c-396e-4006-bf84-5bbe1f948c6a.json\n?? .agents/orchestrator/evidence/ev_6e881202-204f-41ba-9437-553b08158b62.json\n?? .agents/orchestrator/evidence/ev_836d39d7-6709-4748-b75b-c09f1ffafbda.json\n?? .agents/orchestrator/evidence/ev_85a5111f-d2a9-4469-a754-4f7147ac1a5a.json\n?? .agents/orchestrator/evidence/ev_8de8cbd2-87a2-4710-b4fc-637cfb932007.json\n?? .agents/orchestrator/evidence/ev_9c99f044-54f4-4c27-8df0-4db65421f701.json\n?? .agents/orchestrator/evidence/ev_a0892d5d-aecf-4a4c-a6fa-2e5fea8ca1f5.json\n?? .agents/orchestrator/evidence/ev_a30d8e0e-4824-4a86-847d-50e63430c89b.json\n?? .agents/orchestrator/evidence/ev_a43f5263-32d8-4eb3-bd27-2bfaafa096f1.json\n?? .agents/orchestrator/evidence/ev_a4820046-babb-476d-bc5b-89d71853babb.json\n?? .agents/orchestrator/evidence/ev_a61c99f7-a5c3-4e5a-a04c-569adfcc27b0.json\n?? .agents/orchestrator/evidence/ev_af1649d9-ec1e-4b49-af24-73d9531a0799.json\n?? .agents/orchestrator/evidence/ev_c2425b1a-7e3a-44c3-9090-fde387f62d17.json\n?? .agents/orchestrator/evidence/ev_ca6b5769-bf62-4f59-8db5-491c3d141ab1.json\n?? .agents/orchestrator/evidence/ev_cd766de6-e898-4744-80c0-ce165fe24ccd.json\n?? .agents/orchestrator/evidence/ev_d026296f-5f01-42c3-b95d-f32a015aaa19.json\n?? .agents/orchestrator/evidence/ev_d8c28618-bf76-4cc1-b7de-9567560003ae.json\n?? .agents/orchestrator/evidence/ev_dac2cb13-2c47-4c8f-9476-2d2e33fdbe1f.json\n?? .agents/orchestrator/evidence/ev_dfa419bd-17ef-454e-8949-091f4854cd69.json\n?? .agents/orchestrator/evidence/ev_e0ab32b2-8110-45dd-871f-a434cd1acf4c.json\n?? .agents/orchestrator/evidence/ev_e64fb264-a021-4cc9-80be-17a92bedc8eb.json\n?? .agents/orchestrator/evidence/ev_e66679ac-fc10-4660-a0b1-018c083de35f.json\n?? .agents/orchestrator/evidence/ev_e6d6b35a-c09e-481d-90c7-e930463e2522.json\n?? .agents/orchestrator/evidence/ev_f09e9c82-b20e-4249-809e-dd175b34bb7d.json\n?? .agents/orchestrator/evidence/ev_f57fed59-b190-4c85-8e04-46983e257c57.json\n?? .agents/orchestrator/evidence/ev_fbdef059-f346-41fe-ac26-85277c72f301.json\n?? .agents/orchestrator/evidence/ev_fec98d33-1505-4869-acf1-97028b5ab44e.json\n?? .agents/orchestrator/locks/.mutation.lock\n?? .agents/orchestrator/locks/file_94383c49dddee61a583be6a7fb54203181895e517134bbbb1b4bc192eed00fe0.json\n?? .agents/orchestrator/locks/file_f864204a1b85fc379e9b6907bd8511dd73eed53d1facbbd244b15f848937dba8.json\n?? .agents/orchestrator/locks/task_tsk_af6da4ac-7f1c-4b03-ad8b-dd175373894f.json\n?? .agents/orchestrator/tasks/tsk_af6da4ac-7f1c-4b03-ad8b-dd175373894f.json\n?? .agents/orchestrator/tasks/tsk_cb9f4d76-332c-4403-a401-1746c49105ed.json\n?? .agents/orchestrator/tasks/tsk_dc1946cf-d8e4-48c4-8ab3-e4ad834735ab.json\n",
  "hash": "d8e0fb9baff2cf4adae1a0350daf188cc69b7b6b00102f4354354110d92fc274",
  "source": "ORCHESTRATOR"
}
