{
  "id": "ev_ed17123d-770a-4131-b803-d7e1d9e4693b",
  "taskId": "tsk_9cdc1130-7611-40f8-a3f7-06411164ff86",
  "correlationId": "cor_8971b989-17b9-4f20-bb4e-05e1e2977323",
  "type": "OPENCODE_ATTEMPT",
  "command": "POST /session/{sessionID}/prompt_async",
  "exitCode": 0,
  "startedAt": "2026-09-28T00:41:22.511Z",
  "finishedAt": "2026-09-28T00:41:27.843Z",
  "stdout": "",
  "stderr": "",
  "filesChanged": [],
  "gitStatus": "",
  "hash": "dbc1aa7680d1aa6f8fd9832fe99c24cff051d3e4eeb8a09fa84b2b98d11bf98a",
  "source": "opencode-adapter",
  "status": "PROMPT_DISPATCHED",
  "durationMs": 5332,
  "workingDirectory": "D:\\isbulkktc",
  "agent": "build",
  "sessionId": "ses_f1a8a5b2fffe9GuXyQmzdqi3Bi",
  "promptMessageId": "msg_47c5898a-1648-437a-ac86-071e2ad4b85d",
  "providerId": "opencode",
  "modelId": "longcat-2.5-preview-free",
  "projectId": "97c743cd73393b6648837204171935e967f4ae90",
  "worktree": "D:\\isbulkktc",
  "attempt": 1
}
