{
  "id": "ev_f67dcf57-805a-43b2-bf7e-2f1ef81cb2a1",
  "taskId": "tsk_9fb0c4d3-c3a4-421c-8044-8918bb213c22",
  "correlationId": "cor_1d4209ae-3ff6-45df-8453-e073214b8041",
  "type": "OPENCODE_ATTEMPT",
  "command": "POST /session/{sessionID}/prompt_async",
  "exitCode": 0,
  "startedAt": "2026-09-28T02:14:47.675Z",
  "finishedAt": "2026-09-28T02:14:48.711Z",
  "stdout": "",
  "stderr": "",
  "filesChanged": [],
  "gitStatus": "",
  "hash": "1d79dada6cea485454bb2c10f6e6caecaade92860a2422323783f46ac1dc28ef",
  "source": "opencode-adapter",
  "status": "PROMPT_DISPATCHED",
  "durationMs": 1036,
  "workingDirectory": "D:\\isbulkktc",
  "agent": "build",
  "sessionId": "ses_f1a34e3d5ffeqHZaOvO517ss2L",
  "promptMessageId": "msg_35e84c35-73f1-49d0-a553-e8b1cba749f4",
  "providerId": "opencode",
  "modelId": "space-bunny-free",
  "projectId": "97c743cd73393b6648837204171935e967f4ae90",
  "worktree": "D:\\isbulkktc",
  "attempt": 2
}
