{
  "id": "ev_dfb4e70c-9123-42e9-ad3b-fb96c881136f",
  "taskId": "tsk_b51791b2-dc16-40aa-9746-e85ba69b8f6c",
  "correlationId": "cor_c04b5b6f-33bb-4850-8c06-5f97979c14e6",
  "type": "COMMAND",
  "command": "node tools/orchestrator.mjs task-transition --id tsk_b51791b2-dc16-40aa-9746-e85ba69b8f6c --to PLANNED",
  "exitCode": 0,
  "startedAt": "2026-09-27T22:37:54.483Z",
  "finishedAt": "2026-09-27T22:37:54.483Z",
  "stdout": "Updated tsk_b51791b2-dc16-40aa-9746-e85ba69b8f6c: CREATED -> PLANNED",
  "stderr": "",
  "filesChanged": [],
  "gitStatus": " M .agents/orchestrator/state/state.json\n M .agents/orchestrator/tasks/tsk_98745b29-f27b-498a-b516-3acc4b57a028.json\n M app/[yerel]/ilan/[slug]/page.tsx\n M app/api/basvurular/route.ts\n M docs/AJAN-KOORDINASYON.md\n M i18n/mesajlar/en.json\n M i18n/mesajlar/he.json\n M i18n/mesajlar/ru.json\n M i18n/mesajlar/tr.json\n?? .agents/orchestrator/evidence/ev_0057d636-539d-425d-983a-895f3773515f.json\n?? .agents/orchestrator/evidence/ev_19f3d818-1424-4004-9e8c-c0cc6dfe183e.json\n?? .agents/orchestrator/evidence/ev_1a4c2366-91cf-4f8f-9432-fab031348547.json\n?? .agents/orchestrator/evidence/ev_246672ca-894c-4433-b9b0-332ebd513070.json\n?? .agents/orchestrator/evidence/ev_2d5a5d90-618c-413e-8ec0-d208a524d140.json\n?? .agents/orchestrator/evidence/ev_32b752fb-36b8-4050-9f14-a455c60a809d.json\n?? .agents/orchestrator/evidence/ev_38b84830-0bd8-4d91-b1d6-cac6fbc9fb2b.json\n?? .agents/orchestrator/evidence/ev_38d852a5-aa1e-4035-8c0b-0cb9806c2863.json\n?? .agents/orchestrator/evidence/ev_5529deb2-8fec-49fb-ab28-ec53783d5459.json\n?? .agents/orchestrator/evidence/ev_73ebd433-7fa6-4b12-ab49-c1abbc140b15.json\n?? .agents/orchestrator/evidence/ev_96b9f381-8bad-40c9-84b9-45bafa09faf1.json\n?? .agents/orchestrator/evidence/ev_9c369b60-f9c0-42f7-a541-761248afabce.json\n?? .agents/orchestrator/evidence/ev_9f63e519-429f-4628-9d2c-72c970905656.json\n?? .agents/orchestrator/evidence/ev_9f7602ae-8e1b-4251-9d38-dbef8e8a5050.json\n?? .agents/orchestrator/evidence/ev_9ff0f449-7b9b-4b60-b999-8af86a54f14a.json\n?? .agents/orchestrator/evidence/ev_ab700131-7f32-466a-8fdd-296a1714927a.json\n?? .agents/orchestrator/evidence/ev_ab762ae5-79af-4dfb-975d-affbe4adc46f.json\n?? .agents/orchestrator/evidence/ev_b8521ae2-f829-45d4-b2b5-93d847f6a5ea.json\n?? .agents/orchestrator/evidence/ev_bfe8a6d5-f836-4ec5-a259-4896531334d7.json\n?? .agents/orchestrator/evidence/ev_c3861319-109f-49fe-989b-a586a7c746ed.json\n?? .agents/orchestrator/evidence/ev_cc2df631-cc59-4282-9741-e381e64b51eb.json\n?? .agents/orchestrator/evidence/ev_cc8fb98b-527e-4758-908c-0fe5fe6571a5.json\n?? .agents/orchestrator/evidence/ev_db4e5bc5-cffd-408c-857c-235bfb5dba70.json\n?? .agents/orchestrator/evidence/ev_e7dab658-35bc-49dd-b721-1dccef4df7cb.json\n?? .agents/orchestrator/locks/.mutation.lock\n?? .agents/orchestrator/tasks/tsk_4333e727-0569-4894-86af-3f883dc1a6c4.json\n?? .agents/orchestrator/tasks/tsk_7b60f9ef-ab83-4632-af8c-2e0ffb1ce612.json\n?? .agents/orchestrator/tasks/tsk_b51791b2-dc16-40aa-9746-e85ba69b8f6c.json\n",
  "hash": "2691a0ba92565d1417037b19f493a45c23b619d25d0d48deadc4e9ef8268661f",
  "source": "ORCHESTRATOR"
}
