{
  "id": "ev_71fd4afd-2d9f-4d7c-bcbf-858459b28429",
  "taskId": "tsk_f450da26-1d45-488e-a577-bbfdaee991b0",
  "correlationId": "cor_6fe0caaa-aa44-4cc9-8c40-b36335dbd4f7",
  "type": "OPENCODE_ATTEMPT",
  "command": "GET /session/{sessionID}/message",
  "exitCode": null,
  "startedAt": "2026-09-28T10:29:38.573Z",
  "finishedAt": "2026-09-28T10:39:32.476Z",
  "stdout": "",
  "stderr": "OPENCODE_TIMEOUT: no completed assistant message was retrieved for session ses_f186fd64affe4eNA0Y1PhwR6Bd.",
  "filesChanged": [],
  "gitStatus": "",
  "hash": "940af3bb47d2bd74c0cb0edce08f9c18abc80b3d6cc26f841cbb11eadb3ea43a",
  "source": "opencode-adapter",
  "status": "OPENCODE_TIMEOUT",
  "durationMs": 593903,
  "workingDirectory": "D:\\isbulkktc",
  "agent": "build",
  "sessionId": "ses_f186fd64affe4eNA0Y1PhwR6Bd",
  "promptMessageId": "msg_866e4029-5152-4a71-8f50-1a5763828fba",
  "providerId": "opencode",
  "modelId": "space-bunny-free",
  "projectId": "97c743cd73393b6648837204171935e967f4ae90",
  "worktree": "D:\\isbulkktc",
  "attempt": 2,
  "errorCode": "OPENCODE_TIMEOUT",
  "modelChangedFrom": "longcat-2.5-preview-free"
}
