{
  "id": "ev_9f12c67a-80b4-4056-85cf-fd72909ecd3b",
  "taskId": "tsk_d3c5f2d8-7b84-4c3f-9d16-eee6cfaab782",
  "correlationId": "cor_6430b027-1b70-486d-ace4-6ab21fb1075d",
  "type": "OPENCODE_ATTEMPT",
  "command": "POST /session",
  "exitCode": 0,
  "startedAt": "2026-09-27T19:02:16.691Z",
  "finishedAt": "2026-09-27T19:02:16.691Z",
  "stdout": "",
  "stderr": "",
  "filesChanged": [],
  "gitStatus": "",
  "hash": "436c76ba01ef43ab48aaac3560aa99921d5b19130d24b6d337137ac65c3cb151",
  "source": "opencode-adapter",
  "status": "SESSION_CREATED",
  "durationMs": 0,
  "workingDirectory": "D:\\isbulkktc",
  "agent": "plan",
  "sessionId": "ses_f1bc0e2b0ffe2T6T5SFDVm2IWC",
  "promptMessageId": "msg_b05ed5cf-34b4-4473-985a-a55c797f64d4",
  "providerId": "opencode",
  "modelId": "longcat-2.5-preview-free",
  "projectId": "97c743cd73393b6648837204171935e967f4ae90",
  "worktree": "D:\\isbulkktc",
  "attempt": 1
}
