{
  "id": "ev_03fcf355-e800-4393-baae-e99997274b1b",
  "taskId": "tsk_af6da4ac-7f1c-4b03-ad8b-dd175373894f",
  "correlationId": "cor_437cf506-d47a-4a41-bb0d-62f22dcba535",
  "type": "OPENCODE_ATTEMPT",
  "command": "POST /session/{sessionID}/prompt_async",
  "exitCode": 0,
  "startedAt": "2026-09-28T01:56:34.253Z",
  "finishedAt": "2026-09-28T01:56:35.331Z",
  "stdout": "",
  "stderr": "",
  "filesChanged": [],
  "gitStatus": "",
  "hash": "582ae65ae5ffbdc3a01fdba3ae1aeead79a9c9f0838133bc6625335c49e0ff39",
  "source": "opencode-adapter",
  "status": "PROMPT_DISPATCHED",
  "durationMs": 1078,
  "workingDirectory": "D:\\isbulkktc",
  "agent": "build",
  "sessionId": "ses_f1a4592e8ffea7Giv1GuAOtQQO",
  "promptMessageId": "msg_e6de6aef-c905-425c-88fb-3aa0d2590726",
  "providerId": "opencode",
  "modelId": "longcat-2.5-preview-free",
  "projectId": "97c743cd73393b6648837204171935e967f4ae90",
  "worktree": "D:\\isbulkktc",
  "attempt": 1
}
