{
  "id": "ev_e6d6b35a-c09e-481d-90c7-e930463e2522",
  "taskId": "tsk_dc1946cf-d8e4-48c4-8ab3-e4ad834735ab",
  "correlationId": "cor_9927adce-8da0-4b0c-a676-212827efb046",
  "type": "OPENCODE_ATTEMPT",
  "command": "GET /session/{sessionID}/message/{messageID}",
  "exitCode": 403,
  "startedAt": "2026-09-28T01:42:19.401Z",
  "finishedAt": "2026-09-28T01:42:23.781Z",
  "stdout": "",
  "stderr": "The configured OpenCode model was rejected with HTTP 403; only explicitly configured active alternatives may be considered.",
  "filesChanged": [],
  "gitStatus": "",
  "hash": "ccea0878e6369aac7bcd79750c7726ddf5dadd4d8dc927cb78c9ff6779994327",
  "source": "opencode-adapter",
  "status": "DISPATCH_FAILED",
  "durationMs": 4380,
  "workingDirectory": "D:\\isbulkktc",
  "agent": "build",
  "sessionId": "ses_f1a529dceffen9b7A0XsmX1LhL",
  "promptMessageId": "msg_a9c6f89f-fd73-4d7e-83f5-275a0a0c9f97",
  "providerId": "opencode",
  "modelId": "longcat-2.5-preview-free",
  "projectId": "97c743cd73393b6648837204171935e967f4ae90",
  "worktree": "D:\\isbulkktc",
  "attempt": 1,
  "errorCode": "OPENCODE_MODEL_REJECTED",
  "httpStatus": 403
}
