{
  "id": "ev_5529deb2-8fec-49fb-ab28-ec53783d5459",
  "taskId": "tsk_7b60f9ef-ab83-4632-af8c-2e0ffb1ce612",
  "correlationId": "cor_3905fa37-bedc-495f-aa9d-25f420b38460",
  "type": "COMMAND",
  "command": "node tools/orchestrator.mjs task-transition --id tsk_7b60f9ef-ab83-4632-af8c-2e0ffb1ce612 --to PLANNED",
  "exitCode": 0,
  "startedAt": "2026-09-27T22:18:19.927Z",
  "finishedAt": "2026-09-27T22:18:19.927Z",
  "stdout": "Updated tsk_7b60f9ef-ab83-4632-af8c-2e0ffb1ce612: CREATED -> PLANNED",
  "stderr": "",
  "filesChanged": [],
  "gitStatus": " M .agents/orchestrator/state/state.json\n M .agents/orchestrator/tasks/tsk_98745b29-f27b-498a-b516-3acc4b57a028.json\n M docs/AJAN-KOORDINASYON.md\n?? .agents/orchestrator/evidence/ev_246672ca-894c-4433-b9b0-332ebd513070.json\n?? .agents/orchestrator/evidence/ev_2d5a5d90-618c-413e-8ec0-d208a524d140.json\n?? .agents/orchestrator/evidence/ev_32b752fb-36b8-4050-9f14-a455c60a809d.json\n?? .agents/orchestrator/evidence/ev_38d852a5-aa1e-4035-8c0b-0cb9806c2863.json\n?? .agents/orchestrator/evidence/ev_73ebd433-7fa6-4b12-ab49-c1abbc140b15.json\n?? .agents/orchestrator/evidence/ev_9f7602ae-8e1b-4251-9d38-dbef8e8a5050.json\n?? .agents/orchestrator/evidence/ev_9ff0f449-7b9b-4b60-b999-8af86a54f14a.json\n?? .agents/orchestrator/evidence/ev_ab762ae5-79af-4dfb-975d-affbe4adc46f.json\n?? .agents/orchestrator/locks/.mutation.lock\n?? .agents/orchestrator/tasks/tsk_4333e727-0569-4894-86af-3f883dc1a6c4.json\n?? .agents/orchestrator/tasks/tsk_7b60f9ef-ab83-4632-af8c-2e0ffb1ce612.json\n",
  "hash": "4cd4b2d58e0a89309d9d480a3ff2a1c87382ccd571eb0a6f3670abea74f14dce",
  "source": "ORCHESTRATOR"
}
