{
  "id": "ev_db4e5bc5-cffd-408c-857c-235bfb5dba70",
  "taskId": "tsk_7b60f9ef-ab83-4632-af8c-2e0ffb1ce612",
  "correlationId": "cor_3905fa37-bedc-495f-aa9d-25f420b38460",
  "type": "OPENCODE_ATTEMPT",
  "command": "POST /session",
  "exitCode": 0,
  "startedAt": "2026-09-27T22:18:24.342Z",
  "finishedAt": "2026-09-27T22:18:24.342Z",
  "stdout": "",
  "stderr": "",
  "filesChanged": [],
  "gitStatus": "",
  "hash": "383c15714f86f17c6dd398f770c776f289bdc997a49a9df8067311f4e7e353e3",
  "source": "opencode-adapter",
  "status": "SESSION_CREATED",
  "durationMs": 0,
  "workingDirectory": "D:\\isbulkktc",
  "agent": "build",
  "sessionId": "ses_f1b0d5383ffed86oAl6hFtP4w6",
  "promptMessageId": "msg_79214672-c5f0-449c-b7c6-a9e8d35efe42",
  "providerId": "opencode",
  "modelId": "longcat-2.5-preview-free",
  "projectId": "97c743cd73393b6648837204171935e967f4ae90",
  "worktree": "D:\\isbulkktc",
  "attempt": 1
}
