{
  "id": "ev_191b1afb-46bf-49ce-b0c7-c25efeee3b8a",
  "taskId": "tsk_98745b29-f27b-498a-b516-3acc4b57a028",
  "correlationId": "cor_06eec8c4-1862-4744-bed7-07ebafcc5bc6",
  "type": "COMMAND",
  "command": "node tools/orchestrator.mjs task-fail --id tsk_98745b29-f27b-498a-b516-3acc4b57a028",
  "exitCode": 0,
  "startedAt": "2026-09-27T22:03:25.722Z",
  "finishedAt": "2026-09-27T22:03:25.722Z",
  "stdout": "Updated tsk_98745b29-f27b-498a-b516-3acc4b57a028: REVIEWING -> FIX_REQUIRED",
  "stderr": "",
  "filesChanged": [],
  "gitStatus": " M .agents/orchestrator/state/state.json\n M .agents/orchestrator/tasks/tsk_bacf0c3b-2ba9-4578-9cf7-63f71c98a499.json\n M docs/AJAN-KOORDINASYON.md\n M tools/cline-adapter.mjs\n M tools/cline-adapter.test.mjs\n M tools/orchestrator.mjs\n?? .agents/orchestrator/evidence/ev_33561847-fd12-484e-97e2-e0aa158d6cb1.json\n?? .agents/orchestrator/evidence/ev_35850157-679b-472a-8b06-c05fcd756a43.json\n?? .agents/orchestrator/evidence/ev_7be8e59a-de41-48a8-b573-44bfc8c8a1b1.json\n?? .agents/orchestrator/evidence/ev_875f5d74-21f2-4a41-bf70-d4d43335a829.json\n?? .agents/orchestrator/evidence/ev_9aa8fa5d-6456-451c-8cc8-77e1bd7c2bad.json\n?? .agents/orchestrator/evidence/ev_a5c0b380-848a-47da-8e82-c3ca4c492db2.json\n?? .agents/orchestrator/evidence/ev_adc62c1d-e3e2-4708-87e0-9c425433f6e3.json\n?? .agents/orchestrator/evidence/ev_b76b2deb-e80f-4fba-9d9b-cdc6a35ee87a.json\n?? .agents/orchestrator/evidence/ev_b7f87aaa-85ef-4f80-b9c3-41013881c154.json\n?? .agents/orchestrator/evidence/ev_cf58f253-9d26-4fab-a196-3f5cbec5905c.json\n?? .agents/orchestrator/evidence/ev_ead13fea-e8be-41d4-9eab-911602d4d181.json\n?? .agents/orchestrator/evidence/ev_eef86ed1-60fc-435b-a1ed-e091e4895e37.json\n?? .agents/orchestrator/evidence/ev_f14513ac-268e-4fca-b804-588d568aad93.json\n?? .agents/orchestrator/locks/.mutation.lock\n?? .agents/orchestrator/tasks/tsk_98745b29-f27b-498a-b516-3acc4b57a028.json\n",
  "hash": "fd6bcd1d928ba34289372ac3d9fbf9786c2761c20964041f7a4fdab404c525f8",
  "source": "ORCHESTRATOR"
}
