{
  "id": "ev_be9fba52-6de9-463f-8140-aeebcafead19",
  "taskId": "tsk_e3af6954-cb95-4588-b42f-32f71e7c5181",
  "correlationId": "cor_7542aefe-03e0-4476-be2d-e10e88137396",
  "type": "COMMAND",
  "command": "node tools/orchestrator.mjs task-transition --id tsk_e3af6954-cb95-4588-b42f-32f71e7c5181 --to RISK_ASSESSED",
  "exitCode": 0,
  "startedAt": "2026-09-28T00:58:32.712Z",
  "finishedAt": "2026-09-28T00:58:32.712Z",
  "stdout": "Updated tsk_e3af6954-cb95-4588-b42f-32f71e7c5181: PLANNED -> RISK_ASSESSED",
  "stderr": "",
  "filesChanged": [],
  "gitStatus": " M .agents/orchestrator/state/state.json\n M .agents/orchestrator/tasks/tsk_98745b29-f27b-498a-b516-3acc4b57a028.json\n M app/[yerel]/ilan-ara/page.tsx\n M app/[yerel]/ilan/[slug]/layout.tsx\n M app/[yerel]/ilan/[slug]/page.tsx\n M app/api/basvurular/route.ts\n M app/api/ilanlar/route.ts\n M bilesenler/genel/UstGezinmeCubugu.tsx\n M docs/AJAN-KOORDINASYON.md\n M i18n/mesajlar/en.json\n M i18n/mesajlar/he.json\n M i18n/mesajlar/ru.json\n M i18n/mesajlar/tr.json\n M lib/depolar/ilan-arama-deposu.ts\n M tools/opencode-adapter.mjs\n M tools/opencode-adapter.test.mjs\n?? .agents/orchestrator/evidence/ev_0057d636-539d-425d-983a-895f3773515f.json\n?? .agents/orchestrator/evidence/ev_00adef09-39aa-40af-b4e6-163467230e2f.json\n?? .agents/orchestrator/evidence/ev_03d953a7-cc78-41fb-a9b9-49fd211592bc.json\n?? .agents/orchestrator/evidence/ev_04d50113-3c3b-4ee8-9b65-740a9bd682f7.json\n?? .agents/orchestrator/evidence/ev_086f7652-dbe8-429e-90f9-213020532c83.json\n?? .agents/orchestrator/evidence/ev_08b3a641-b6ac-4737-8d6b-8c9969fc869c.json\n?? .agents/orchestrator/evidence/ev_0a1b91f9-92ac-47c3-9f45-24b6045394c1.json\n?? .agents/orchestrator/evidence/ev_0b8805a2-2256-47dd-b5b7-496f4cb78070.json\n?? .agents/orchestrator/evidence/ev_0bdc4bef-04a6-41f4-a60a-5d085b236b54.json\n?? .agents/orchestrator/evidence/ev_0d2d9213-cf61-4f97-a4e8-a2a8f274a57c.json\n?? .agents/orchestrator/evidence/ev_0ec7bb89-f6ce-40c4-ae77-299ae6f0576a.json\n?? .agents/orchestrator/evidence/ev_10406153-a2e0-4de0-bbba-ad3df7116524.json\n?? .agents/orchestrator/evidence/ev_1289109a-0c66-4308-ae0a-e505e5f5760c.json\n?? .agents/orchestrator/evidence/ev_18535dca-7dee-4ff4-8e08-68da3202eb38.json\n?? .agents/orchestrator/evidence/ev_199cac20-1cb4-4c14-8dfd-37e0f976a41f.json\n?? .agents/orchestrator/evidence/ev_19f3d818-1424-4004-9e8c-c0cc6dfe183e.json\n?? .agents/orchestrator/evidence/ev_1a4c2366-91cf-4f8f-9432-fab031348547.json\n?? .agents/orchestrator/evidence/ev_1e7e37fe-32a9-4675-882a-c8057cb23e8d.json\n?? .agents/orchestrator/evidence/ev_246672ca-894c-4433-b9b0-332ebd513070.json\n?? .agents/orchestrator/evidence/ev_287dcf8a-dd49-41a2-aaa2-169b584e57c1.json\n?? .agents/orchestrator/evidence/ev_2d5a5d90-618c-413e-8ec0-d208a524d140.json\n?? .agents/orchestrator/evidence/ev_3017c01e-078b-47af-b538-9deeebabcd71.json\n?? .agents/orchestrator/evidence/ev_316c2dbf-a032-4ce0-acb2-f55b6691d19e.json\n?? .agents/orchestrator/evidence/ev_3266326f-a821-4a47-8a88-1aad9b7979fe.json\n?? .agents/orchestrator/evidence/ev_32b752fb-36b8-4050-9f14-a455c60a809d.json\n?? .agents/orchestrator/evidence/ev_3580ea46-2d25-4cdf-a307-bc544d0b31f3.json\n?? .agents/orchestrator/evidence/ev_38b84830-0bd8-4d91-b1d6-cac6fbc9fb2b.json\n?? .agents/orchestrator/evidence/ev_38d852a5-aa1e-4035-8c0b-0cb9806c2863.json\n?? .agents/orchestrator/evidence/ev_391fcec3-f9f5-4020-a4d4-a4b2379fa4f3.json\n?? .agents/orchestrator/evidence/ev_3ac84281-b79e-43de-a39a-5e088c6a2d26.json\n?? .agents/orchestrator/evidence/ev_3cd76eeb-d5c1-4321-bcbc-fa62dfa23163.json\n?? .agents/orchestrator/evidence/ev_3cdac5bd-4e52-4946-8242-c2696b4edaa9.json\n?? .agents/orchestrator/evidence/ev_3cdd47b9-50f3-49a2-aaaa-d213a575a876.json\n?? .agents/orchestrator/evidence/ev_48450c17-46bb-4198-a4fa-a61c04292180.json\n?? .agents/orchestrator/evidence/ev_4946ab7b-3cec-4418-ab8c-4792f2fc1269.json\n?? .agents/orchestrator/evidence/ev_4b046a7a-303b-48a9-954d-8015c9625e43.json\n?? .agents/orchestrator/evidence/ev_4dd96b33-b51f-45fe-ba2c-58da4d9de66a.json\n?? .agents/orchestrator/evidence/ev_5529deb2-8fec-49fb-ab28-ec53783d5459.json\n?? .agents/orchestrator/evidence/ev_65d47bcd-4179-4cbf-881a-effd6fdbcde5.json\n?? .agents/orchestrator/evidence/ev_6a5686f9-6c8a-4534-a9dd-9cd641869e92.json\n?? .agents/orchestrator/evidence/ev_71f05c93-0d51-47c8-aad9-c2966df6d904.json\n?? .agents/orchestrator/evidence/ev_73ebd433-7fa6-4b12-ab49-c1abbc140b15.json\n?? .agents/orchestrator/evidence/ev_7667afdc-6ad3-4f0b-b492-34adbfe239f5.json\n?? .agents/orchestrator/evidence/ev_7a8cfb90-3809-4dd9-bf0a-7e4fb699a52b.json\n?? .agents/orchestrator/evidence/ev_7f002b1b-efab-4157-8ac1-8d9a3c9b83a3.json\n?? .agents/orchestrator/evidence/ev_81ec8c16-9c49-40d2-b60c-d68c55457734.json\n?? .agents/orchestrator/evidence/ev_83826199-8dd3-4ee7-95a9-5e97d248eba1.json\n?? .agents/orchestrator/evidence/ev_8a4dbd58-4d4f-4023-adca-be6adb00ea2d.json\n?? .agents/orchestrator/evidence/ev_91fa2afa-a084-4c30-8b4e-d089c5a21545.json\n?? .agents/orchestrator/evidence/ev_96b9f381-8bad-40c9-84b9-45bafa09faf1.json\n?? .agents/orchestrator/evidence/ev_96ce6f0c-5b62-4f6b-8b40-5f93959a5b2a.json\n?? .agents/orchestrator/evidence/ev_970960ef-b7e4-4726-a4dc-9fa91a5cd2b3.json\n?? .agents/orchestrator/evidence/ev_995f547b-640c-4dbf-a320-1a71e20fdbaf.json\n?? .agents/orchestrator/evidence/ev_99e62333-7612-4eaf-894a-b9224fdc8c23.json\n?? .agents/orchestrator/evidence/ev_9ba1e302-0621-47b0-a467-257c0596116a.json\n?? .agents/orchestrator/evidence/ev_9bf4e541-1113-4ef7-ab92-85e7b9e6fb7f.json\n?? .agents/orchestrator/evidence/ev_9c369b60-f9c0-42f7-a541-761248afabce.json\n?? .agents/orchestrator/evidence/ev_9f63e519-429f-4628-9d2c-72c970905656.json\n?? .agents/orchestrator/evidence/ev_9f7602ae-8e1b-4251-9d38-dbef8e8a5050.json\n?? .agents/orchestrator/evidence/ev_9ff0f449-7b9b-4b60-b999-8af86a54f14a.json\n?? .agents/orchestrator/evidence/ev_a20e7592-a321-4d17-a892-ddbfba2033fe.json\n?? .agents/orchestrator/evidence/ev_a451f63f-44af-431b-b965-34072d5459a9.json\n?? .agents/orchestrator/evidence/ev_a6efb96c-efc4-445c-80de-54623e25a075.json\n?? .agents/orchestrator/evidence/ev_a8790e8f-6206-484f-8762-64d2d8e9a288.json\n?? .agents/orchestrator/evidence/ev_a8efe70f-712b-451f-ad89-0ca4c4e0938b.json\n?? .agents/orchestrator/evidence/ev_aa764412-beac-4636-8a53-304cb4b8a501.json\n?? .agents/orchestrator/evidence/ev_ab700131-7f32-466a-8fdd-296a1714927a.json\n?? .agents/orchestrator/evidence/ev_ab762ae5-79af-4dfb-975d-affbe4adc46f.json\n?? .agents/orchestrator/evidence/ev_aece56c6-fd14-4f0d-b67b-7eb436dc681b.json\n?? .agents/orchestrator/evidence/ev_b8521ae2-f829-45d4-b2b5-93d847f6a5ea.json\n?? .agents/orchestrator/evidence/ev_bc4f0b43-df8d-4241-a28c-8eb277ae983b.json\n?? .agents/orchestrator/evidence/ev_bd0eb6a2-f16e-4e65-bb42-387e1a8754ca.json\n?? .agents/orchestrator/evidence/ev_bfe8a6d5-f836-4ec5-a259-4896531334d7.json\n?? .agents/orchestrator/evidence/ev_c3861319-109f-49fe-989b-a586a7c746ed.json\n?? .agents/orchestrator/evidence/ev_c63943c2-3302-4d71-ad1d-05150cbebee3.json\n?? .agents/orchestrator/evidence/ev_c7cafff4-89f1-4921-beb9-4ea99d90c191.json\n?? .agents/orchestrator/evidence/ev_c8c486c3-2eac-43c3-af03-6c71e6e882fa.json\n?? .agents/orchestrator/evidence/ev_ca004742-c968-4d32-a71a-ac58f4ebae6b.json\n?? .agents/orchestrator/evidence/ev_cc2df631-cc59-4282-9741-e381e64b51eb.json\n?? .agents/orchestrator/evidence/ev_cc8fb98b-527e-4758-908c-0fe5fe6571a5.json\n?? .agents/orchestrator/evidence/ev_d15163c8-e1e8-4670-88f0-66a77cac6114.json\n?? .agents/orchestrator/evidence/ev_d63fd156-b324-4e2e-a39d-81841b699731.json\n?? .agents/orchestrator/evidence/ev_dadfbf93-40df-4869-a61d-1c904e651f7f.json\n?? .agents/orchestrator/evidence/ev_db4e5bc5-cffd-408c-857c-235bfb5dba70.json\n?? .agents/orchestrator/evidence/ev_dfb4e70c-9123-42e9-ad3b-fb96c881136f.json\n?? .agents/orchestrator/evidence/ev_e00d9880-14fa-46cf-88ef-b78cdd1fb6b9.json\n?? .agents/orchestrator/evidence/ev_e0f1c59b-af7b-44b4-984c-6d6d763438a5.json\n?? .agents/orchestrator/evidence/ev_e2066da6-cb36-4de9-84d5-0b51609ba258.json\n?? .agents/orchestrator/evidence/ev_e2c0dc4d-6d9c-4a4d-adae-18396901171b.json\n?? .agents/orchestrator/evidence/ev_e5f90c45-70e0-45f2-a95a-6b8fec8db137.json\n?? .agents/orchestrator/evidence/ev_e7dab658-35bc-49dd-b721-1dccef4df7cb.json\n?? .agents/orchestrator/evidence/ev_e90a9cbb-f404-4aa5-afaf-cbedfd144dc0.json\n?? .agents/orchestrator/evidence/ev_ed17123d-770a-4131-b803-d7e1d9e4693b.json\n?? .agents/orchestrator/evidence/ev_f4356e72-cd3e-4bcc-bf02-14059085b1c3.json\n?? .agents/orchestrator/evidence/ev_f84837f0-2798-4933-b826-5cf8f734c8e8.json\n?? .agents/orchestrator/evidence/ev_fe752f16-5a67-4e53-ba77-042e65c07a3d.json\n?? .agents/orchestrator/locks/.mutation.lock\n?? .agents/orchestrator/tasks/tsk_1e87af96-e866-425e-b42f-5c658a3b61e0.json\n?? .agents/orchestrator/tasks/tsk_3bd96ca6-3d4c-4188-8ce8-41507d0dd314.json\n?? .agents/orchestrator/tasks/tsk_4333e727-0569-4894-86af-3f883dc1a6c4.json\n?? .agents/orchestrator/tasks/tsk_7b60f9ef-ab83-4632-af8c-2e0ffb1ce612.json\n?? .agents/orchestrator/tasks/tsk_99541582-f790-45a7-a8b6-16dfc5ef6d37.json\n?? .agents/orchestrator/tasks/tsk_9cdc1130-7611-40f8-a3f7-06411164ff86.json\n?? .agents/orchestrator/tasks/tsk_b160f747-e870-463c-b35f-db423c61f42c.json\n?? .agents/orchestrator/tasks/tsk_b51791b2-dc16-40aa-9746-e85ba69b8f6c.json\n?? .agents/orchestrator/tasks/tsk_e3af6954-cb95-4588-b42f-32f71e7c5181.json\n?? app/api/ilanlar/[slug]/\n?? bilesenler/ilan/VeritabaniIlanBasvurusu.tsx\n?? bilesenler/ilan/VeritabaniIlanDetayi.tsx\n?? bilesenler/ilan/VeritabaniIlanKart.tsx\n",
  "hash": "5ec95ca62dcec423e991f1c495cd0c0c335629eec08093bf43af944e7b498931",
  "source": "ORCHESTRATOR"
}
