{
  "id": "ev_7039ea57-8310-418c-b190-3fddc58b6f2e",
  "taskId": "tsk_9fb0c4d3-c3a4-421c-8044-8918bb213c22",
  "correlationId": "cor_1d4209ae-3ff6-45df-8453-e073214b8041",
  "type": "COMMAND",
  "command": "node tools/orchestrator.mjs cline-review --id tsk_9fb0c4d3-c3a4-421c-8044-8918bb213c22",
  "exitCode": 0,
  "startedAt": "2026-09-28T02:19:13.054Z",
  "finishedAt": "2026-09-28T02:19:13.054Z",
  "stdout": "Updated tsk_9fb0c4d3-c3a4-421c-8044-8918bb213c22: REVIEWING -> REVIEWING",
  "stderr": "",
  "filesChanged": [],
  "gitStatus": " M .agents/orchestrator/state/state.json\n M .agents/orchestrator/tasks/tsk_e3af6954-cb95-4588-b42f-32f71e7c5181.json\n M app/[yerel]/ilan/[slug]/page.tsx\n M \"bilesenler/ilan/IlanKart\\304\\261.tsx\"\n M docs/AJAN-KOORDINASYON.md\n?? .agents/orchestrator/evidence/ev_027ab42c-a535-45fd-916f-b525508fd362.json\n?? .agents/orchestrator/evidence/ev_03fcf355-e800-4393-baae-e99997274b1b.json\n?? .agents/orchestrator/evidence/ev_0fe86876-38eb-441a-adc6-2aafad880388.json\n?? .agents/orchestrator/evidence/ev_151609e9-4c9f-467d-b44a-31acb35bb6c6.json\n?? .agents/orchestrator/evidence/ev_15fd0f1d-8221-4e0c-8a97-509e2509174f.json\n?? .agents/orchestrator/evidence/ev_18f310a2-a8e7-458a-9e10-e154e8db4a47.json\n?? .agents/orchestrator/evidence/ev_259d778a-59d7-4ce9-88bc-6082de5d8880.json\n?? .agents/orchestrator/evidence/ev_2f66d597-2db2-41b3-b53d-59aed89e4c3a.json\n?? .agents/orchestrator/evidence/ev_38ec908d-240d-41e2-8551-11b12e1437d2.json\n?? .agents/orchestrator/evidence/ev_4849979d-6a91-4a5c-b0ae-9d11740b1aea.json\n?? .agents/orchestrator/evidence/ev_48bc9f8b-6881-42e8-a3fa-5f6fe743eafc.json\n?? .agents/orchestrator/evidence/ev_49183537-042d-4cc9-9ab3-9aad31032111.json\n?? .agents/orchestrator/evidence/ev_4a24f641-84f2-4679-aa49-17663f5e9d67.json\n?? .agents/orchestrator/evidence/ev_537fc39c-0d37-472a-8b7d-4175da6b7b42.json\n?? .agents/orchestrator/evidence/ev_5419e12b-dd9d-4a69-b5a1-289dcd851ff5.json\n?? .agents/orchestrator/evidence/ev_5dcba7fe-f959-4be7-bec5-be768b8ceec1.json\n?? .agents/orchestrator/evidence/ev_6cfe806c-396e-4006-bf84-5bbe1f948c6a.json\n?? .agents/orchestrator/evidence/ev_6e881202-204f-41ba-9437-553b08158b62.json\n?? .agents/orchestrator/evidence/ev_74924dfe-89c5-4e6e-b6a3-32c744628d82.json\n?? .agents/orchestrator/evidence/ev_76b9ee4b-9530-470f-aa6b-713f537a92f0.json\n?? .agents/orchestrator/evidence/ev_79c49eee-7bd5-4178-b6ee-6b6972c1859f.json\n?? .agents/orchestrator/evidence/ev_7e449dba-3855-4c95-8fc3-6059a65286d9.json\n?? .agents/orchestrator/evidence/ev_82525246-5c92-4ec1-84ee-d63b3b134361.json\n?? .agents/orchestrator/evidence/ev_836d39d7-6709-4748-b75b-c09f1ffafbda.json\n?? .agents/orchestrator/evidence/ev_85a5111f-d2a9-4469-a754-4f7147ac1a5a.json\n?? .agents/orchestrator/evidence/ev_8de8cbd2-87a2-4710-b4fc-637cfb932007.json\n?? .agents/orchestrator/evidence/ev_95cbc407-8413-4936-b15a-15895de32d62.json\n?? .agents/orchestrator/evidence/ev_9c99f044-54f4-4c27-8df0-4db65421f701.json\n?? .agents/orchestrator/evidence/ev_a0892d5d-aecf-4a4c-a6fa-2e5fea8ca1f5.json\n?? .agents/orchestrator/evidence/ev_a30d8e0e-4824-4a86-847d-50e63430c89b.json\n?? .agents/orchestrator/evidence/ev_a43f5263-32d8-4eb3-bd27-2bfaafa096f1.json\n?? .agents/orchestrator/evidence/ev_a4820046-babb-476d-bc5b-89d71853babb.json\n?? .agents/orchestrator/evidence/ev_a552fef5-c04e-4801-a8a5-e8597ca4eb04.json\n?? .agents/orchestrator/evidence/ev_a61c99f7-a5c3-4e5a-a04c-569adfcc27b0.json\n?? .agents/orchestrator/evidence/ev_af1649d9-ec1e-4b49-af24-73d9531a0799.json\n?? .agents/orchestrator/evidence/ev_c2425b1a-7e3a-44c3-9090-fde387f62d17.json\n?? .agents/orchestrator/evidence/ev_c327158b-b501-4457-86f2-e8f2a59a94da.json\n?? .agents/orchestrator/evidence/ev_c78be4dc-79db-458e-8c43-3c4741974be7.json\n?? .agents/orchestrator/evidence/ev_ca6b5769-bf62-4f59-8db5-491c3d141ab1.json\n?? .agents/orchestrator/evidence/ev_caeeeb56-bb01-43d8-88cf-658dfd438b0c.json\n?? .agents/orchestrator/evidence/ev_cd766de6-e898-4744-80c0-ce165fe24ccd.json\n?? .agents/orchestrator/evidence/ev_d026296f-5f01-42c3-b95d-f32a015aaa19.json\n?? .agents/orchestrator/evidence/ev_d3fc816d-5bb6-4d0f-8cdf-e4d02d4f52cc.json\n?? .agents/orchestrator/evidence/ev_d8c28618-bf76-4cc1-b7de-9567560003ae.json\n?? .agents/orchestrator/evidence/ev_da854c67-54ef-446e-9ac1-4e0462955b38.json\n?? .agents/orchestrator/evidence/ev_dac2cb13-2c47-4c8f-9476-2d2e33fdbe1f.json\n?? .agents/orchestrator/evidence/ev_dfa419bd-17ef-454e-8949-091f4854cd69.json\n?? .agents/orchestrator/evidence/ev_e0ab32b2-8110-45dd-871f-a434cd1acf4c.json\n?? .agents/orchestrator/evidence/ev_e64fb264-a021-4cc9-80be-17a92bedc8eb.json\n?? .agents/orchestrator/evidence/ev_e664c595-cb7d-4e58-b17b-a66832c7f679.json\n?? .agents/orchestrator/evidence/ev_e66679ac-fc10-4660-a0b1-018c083de35f.json\n?? .agents/orchestrator/evidence/ev_e6d6b35a-c09e-481d-90c7-e930463e2522.json\n?? .agents/orchestrator/evidence/ev_ea2b929a-e57a-4550-9720-2a20579377a5.json\n?? .agents/orchestrator/evidence/ev_ef253b2e-afaa-4a7f-8bca-4377c70e4a1c.json\n?? .agents/orchestrator/evidence/ev_efd2f1da-8413-42c7-bf57-bb406eae0848.json\n?? .agents/orchestrator/evidence/ev_f09e9c82-b20e-4249-809e-dd175b34bb7d.json\n?? .agents/orchestrator/evidence/ev_f35831e9-99de-44c4-9c58-9e289e62bcfd.json\n?? .agents/orchestrator/evidence/ev_f57fed59-b190-4c85-8e04-46983e257c57.json\n?? .agents/orchestrator/evidence/ev_f67dcf57-805a-43b2-bf7e-2f1ef81cb2a1.json\n?? .agents/orchestrator/evidence/ev_fbdef059-f346-41fe-ac26-85277c72f301.json\n?? .agents/orchestrator/evidence/ev_fec98d33-1505-4869-acf1-97028b5ab44e.json\n?? .agents/orchestrator/locks/.mutation.lock\n?? .agents/orchestrator/tasks/tsk_9fb0c4d3-c3a4-421c-8044-8918bb213c22.json\n?? .agents/orchestrator/tasks/tsk_af6da4ac-7f1c-4b03-ad8b-dd175373894f.json\n?? .agents/orchestrator/tasks/tsk_cb9f4d76-332c-4403-a401-1746c49105ed.json\n?? .agents/orchestrator/tasks/tsk_dc1946cf-d8e4-48c4-8ab3-e4ad834735ab.json\n",
  "hash": "76a69d722a96439a952dc89ed0a30b7f936c82b842078fa633abb2e2ef449ad4",
  "source": "ORCHESTRATOR"
}
